{
  "schemaVersion": "1.0",
  "status": "review",
  "slug": "courtyard-house-renewal",
  "title": "庭院老宅新生",
  "subtitle": "從老宅外牆、庭院與室內機能全面更新，重新整理採光、通風與生活動線，讓既有住宅展開更自在的新生活。",
  "location": "台灣",
  "district": null,
  "area": null,
  "services": [
    "老屋翻新工程",
    "住宅空間設計",
    "工程整合"
  ],
  "style": [
    "現代",
    "自然"
  ],
  "coverImage": "cover/cover-01.jpg",
  "gallery": [
    "gallery/gallery-01.jpg",
    "gallery/gallery-02.jpg",
    "gallery/gallery-03.jpg"
  ],
  "before": [
    "before/before-01.jpg",
    "before/before-02.jpg"
  ],
  "after": [
    "after/after-01.jpg",
    "after/after-02.jpg"
  ],
  "publishDate": null,
  "featured": false
}
